{
  "app": {
    "name": "AMI",
    "subtitle": "Active Monitor of Internet",
    "version": "3.2.0",
    "copyright": "© 2025–2026 CiaoIM™ by Daniel Giovannetti",
    "website": "https://ciaoim.tech/projects/ami",
    "tagline": "Crafted logic. Measured force. Front-end vision, compiled systems, and hardcoded ethics.",
    "inspiration": "Intuizione colta insieme a Giovanni Calvario in aliscafo per il 40° Convegno di Capri dei Giovani Imprenditori"
  },
  "monitoring": {
    "ping_hosts": [
      "8.8.8.8",
      "1.1.1.1",
      "github.com"
    ],
    "http_test_url": "https://www.google.com/generate_204",
    "http_test_urls": [],
    "polling_interval": 1,
    "timeout": 5,
    "retry_count": 2,
    "enable_http_test": true,
    "internal_test_mode": false
  },
  "thresholds": {
    "unstable_latency_ms": 500,
    "unstable_loss_percent": 30
  },
  "notifications": {
    "enabled": true,
    "silent_mode": false,
    "notify_on_disconnect": true,
    "notify_on_reconnect": true,
    "notify_on_unstable": false
  },
  "logging": {
    "enabled": true,
    "log_file": "ami_log.csv",
    "max_log_size_mb": 1
  },
  "api": {
    "enabled": false,
    "port": 7212,
    "auth_token": ""
  },
  "startup": {
    "auto_start": false
  },
  "ui": {
    "theme": "auto",
    "show_dashboard_on_start": false,
    "compact_status_window": false
  },
  "updates": {
    "enabled": true,
    "check_on_startup": true,
    "check_interval_hours": 24,
    "github_repo": "dgiovannetti/AMI",
    "max_postponements": 3,
    "notify_on_update": true
  },
  "speed_test": {
    "enabled": true,
    "interval_minutes": 30,
    "test_url": "https://fsn1-speed.hetzner.com/100MB.bin",
    "download_size_mb": 10,
    "warmup_mb": 2,
    "timeout_seconds": 30,
    "tier_low_mbps": 100,
    "tier_high_mbps": 1000
  }
}